					Task - WHAT	Method (=key feature) - HOW	Learning Aspect - HOW	Core target - WHY		Subtask	Submethod	Subtarget
1708.00055	SemEval-2017 Task 1: Semantic Textual Similarity - Multilingual and   Cross-lingual Focused Evaluation	78	zscore: 3.665163	Semantic Textual Similarity (STS) measures the meaning similarity of sentences. Applications include machine translation (MT), summarization, generation, question answering (QA), short answer grading, semantic search, dialog and conversational systems. The STS shared task is a venue for assessing the current state-of-the-art. The 2017 task focuses on multilingual and cross-lingual pairs with one sub-track exploring MT quality estimation (MTQE) data. The task obtained strong participation from 31 teams, with 17 participating in all language tracks. We summarize performance and review a selection of well performing methods. Analysis highlights common errors, providing insight into the limitations of existing models. To support ongoing work on semantic representations, the STS Benchmark is introduced as a new shared training and evaluation set carefully selected from the corpus of English STS shared task data (2012-2017).	Text representations	Shared Task		Other		Sentence		
1712.0569	Sockeye: A Toolkit for Neural Machine Translation	48	zscore: 3.651046	We describe Sockeye (version 1.12), an open-source sequence-to-sequence toolkit for Neural Machine Translation (NMT). Sockeye is a production-ready framework for training and applying models as well as an experimental platform for researchers. Written in Python and built on MXNet, the toolkit offers scalable training and inference for the three most prominent encoder-decoder architectures: attentional recurrent neural networks, self-attentional transformers, and fully convolutional networks. Sockeye also supports a wide range of optimizers, normalization and regularization techniques, and inference improvements from current NMT literature. Users can easily run standard training recipes, explore different model settings, and incorporate new ideas. In this paper, we highlight Sockeye's features and benchmark it against other NMT toolkits on two language arcs from the 2017 Conference on Machine Translation (WMT): English-German and Latvian-English. We report competitive BLEU scores across all three architectures, including an overall best score for Sockeye's transformer implementation. To facilitate further comparison, we release all system outputs and training scripts used in our experiments. The Sockeye toolkit is free software released under the Apache 2.0 license.	MT	Toolkit		Other				
1805.02266	Breaking NLI Systems with Sentences that Require Simple Lexical   Inferences	16	zscore: 3.636955	We create a new NLI test set that shows the deficiency of state-of-the-art models in inferences that require lexical and world knowledge. The new examples are simpler than the SNLI test set, containing sentences that differ by at most one word from sentences in the training set. Yet, the performance on the new test set is substantially worse across systems trained on SNLI, demonstrating that these systems are limited in their generalization ability, failing to capture many simple inferences.	Sentence Classification	Adversaries		Exposing weaknesses		NLI		of systems
1809.10185	Graph Convolution over Pruned Dependency Trees Improves Relation   Extraction	4	zscore: 3.618701	Dependency trees help relation extraction models capture long-range relations between words. However, existing dependency-based models either neglect crucial information (e.g., negation) by pruning the dependency trees too aggressively, or are computationally inefficient because it is difficult to parallelize over different tree structures. We propose an extension of graph convolutional networks that is tailored for relation extraction, which pools information over arbitrary dependency structures efficiently in parallel. To incorporate relevant information while maximally removing irrelevant content, we further apply a novel pruning strategy to the input trees by keeping words immediately around the shortest path between the two entities among which a relation might hold. The resulting model achieves state-of-the-art performance on the large-scale TACRED dataset, outperforming existing sequence and dependency-based neural models. We also show through detailed analysis that this model has complementary strengths to sequence models, and combining them further improves the state of the art.	Relation extraction	Graph convolutional networks		Better accuracy				
1808.08795	An Auto-Encoder Matching Model for Learning Utterance-Level Semantic   Dependency in Dialogue Generation	6	zscore: 3.517138	Generating semantically coherent responses is still a major challenge in dialogue generation. Different from conventional text generation tasks, the mapping between inputs and responses in conversations is more complicated, which highly demands the understanding of utterance-level semantic dependency, a relation between the whole meanings of inputs and outputs. To address this problem, we propose an Auto-Encoder Matching (AEM) model to learn such dependency. The model contains two auto-encoders and one mapping module. The auto-encoders learn the semantic representations of inputs and responses, and the mapping module learns to connect the utterance-level representations. Experimental results from automatic and human evaluations demonstrate that our model is capable of generating responses of high coherence and fluency compared to baseline models. The code is available at https://github.com/lancopku/AMM	Generation	Autoencoder		Better accuracy		Dialogue		
1705.03551	TriviaQA: A Large Scale Distantly Supervised Challenge Dataset for   Reading Comprehension	114	zscore: 3.511683	We present TriviaQA, a challenging reading comprehension dataset containing over 650K question-answer-evidence triples. TriviaQA includes 95K question-answer pairs authored by trivia enthusiasts and independently gathered evidence documents, six per question on average, that provide high quality distant supervision for answering the questions. We show that, in comparison to other recently introduced large-scale datasets, TriviaQA (1) has relatively complex, compositional questions, (2) has considerable syntactic and lexical variability between questions and corresponding answer-evidence sentences, and (3) requires more cross sentence reasoning to find answers. We also present two baseline algorithms: a feature-based classifier and a state-of-the-art neural network, that performs well on SQuAD reading comprehension. Neither approach comes close to human performance (23% and 40% vs. 80%), suggesting that TriviaQA is a challenging testbed that is worth significant future study. Data and code available at -- http://nlp.cs.washington.edu/triviaqa/	Generation	Data		More difficult task/data		QA		
1803.11138	Colorless green recurrent networks dream hierarchically	26	zscore: 3.494598	Recurrent neural networks (RNNs) have achieved impressive results in a variety of linguistic processing tasks, suggesting that they can induce non-trivial properties of language. We investigate here to what extent RNNs learn to track abstract hierarchical syntactic structure. We test whether RNNs trained with a generic language modeling objective in four languages (Italian, English, Hebrew, Russian) can predict long-distance number agreement in various constructions. We include in our evaluation nonsensical sentences where RNNs cannot rely on semantic or lexical cues ("The colorless green ideas I ate with the chair sleep furiously"), and, for Italian, we compare model performance to human intuitions. Our language-model-trained RNNs make reliable predictions about long-distance agreement, and do not lag much behind human performance. We thus bring support to the hypothesis that RNNs are not just shallow-pattern extractors, but they also acquire deeper grammatical competence.	Language Modeling	RNN	Evaluation	Insights				
1803.02155	Self-Attention with Relative Position Representations	26	zscore: 3.364866	Relying entirely on an attention mechanism, the Transformer introduced by Vaswani et al. (2017) achieves state-of-the-art results for machine translation. In contrast to recurrent and convolutional neural networks, it does not explicitly model relative or absolute position information in its structure. Instead, it requires adding representations of absolute positions to its inputs. In this work we present an alternative approach, extending the self-attention mechanism to efficiently consider representations of the relative positions, or distances between sequence elements. On the WMT 2014 English-to-German and English-to-French translation tasks, this approach yields improvements of 1.3 BLEU and 0.3 BLEU over absolute position representations, respectively. Notably, we observe that combining relative and absolute position representations yields no further improvement in translation quality. We describe an efficient implementation of our method and cast it as an instance of relation-aware self-attention mechanisms that can generalize to arbitrary graph-labeled inputs.	MT	Attention		Better accuracy				
1705.09655	Style Transfer from Non-Parallel Text by Cross-Alignment	73	zscore: 3.360868	This paper focuses on style transfer on the basis of non-parallel text. This is an instance of a broad family of problems including machine translation, decipherment, and sentiment modification. The key challenge is to separate the content from other aspects such as style. We assume a shared latent content distribution across different text corpora, and propose a method that leverages refined alignment of latent representations to perform style transfer. The transferred sentences from one style should match example sentences from the other style as a population. We demonstrate the effectiveness of this cross-alignment method on three tasks: sentiment modification, decipherment of word substitution ciphers, and recovery of word order.	Style transfer	NA	unsupervised	Better accuracy				
1806.09102	Modeling Multi-turn Conversation with Deep Utterance Aggregation	11	zscore: 3.360759	Multi-turn conversation understanding is a major challenge for building intelligent dialogue systems. This work focuses on retrieval-based response matching for multi-turn conversation whose related work simply concatenates the conversation utterances, ignoring the interactions among previous utterances for context modeling. In this paper, we formulate previous utterances into context using a proposed deep utterance aggregation model to form a fine-grained context representation. In detail, a self-matching attention is first introduced to route the vital information in each utterance. Then the model matches a response with each refined utterance and the final matching score is obtained after attentive turns aggregation. Experimental results show our model outperforms the state-of-the-art methods on three multi-turn conversation benchmarks, including a newly introduced e-commerce dialogue corpus.	Generation	Attention		Better accuracy		Dialogue		
1806.09103	Subword-augmented Embedding for Cloze Reading Comprehension	11	zscore: 3.360759	Representation learning is the foundation of machine reading comprehension. In state-of-the-art models, deep learning methods broadly use word and character level representations. However, character is not naturally the minimal linguistic unit. In addition, with a simple concatenation of character and word embedding, previous models actually give suboptimal solution. In this paper, we propose to use subword rather than character for word embedding enhancement. We also empirically explore different augmentation strategies on subword-augmented embedding to enhance the cloze-style reading comprehension model reader. In detail, we present a reader that uses subword-level representation to augment word embedding with a short list to handle rare words effectively. A thorough examination is conducted to evaluate the comprehensive performance and generalization ability of the proposed reader. Experimental results show that the proposed approach helps the reader significantly outperform the state-of-the-art baselines on various public datasets.	Text representations	Subword		Better accuracy		Subword		
1806.09105	One-shot Learning for Question-Answering in Gaokao History Challenge	11	zscore: 3.360759	Answering questions from university admission exams (Gaokao in Chinese) is a challenging AI task since it requires effective representation to capture complicated semantic relations between questions and answers. In this work, we propose a hybrid neural model for deep question-answering task from history examinations. Our model employs a cooperative gated neural network to retrieve answers with the assistance of extra labels given by a neural turing machine labeler. Empirical study shows that the labeler works well with only a small training dataset and the gated mechanism is good at fetching the semantic representation of lengthy answers. Experiments on question answering demonstrate the proposed model obtains substantial performance gains over various neural model baselines in terms of multiple evaluation metrics.	Generation	Combination		Better accuracy		QA		
1808.04444	Character-Level Language Modeling with Deeper Self-Attention	5	zscore: 3.311076	LSTMs and other RNN variants have shown strong performance on character-level language modeling. These models are typically trained using truncated backpropagation through time, and it is common to assume that their success stems from their ability to remember long-term contexts. In this paper, we show that a deep (64-layer) transformer model with fixed context outperforms RNN variants by a large margin, achieving state of the art on two popular benchmarks: 1.13 bits per character on text8 and 1.06 on enwik8. To get good results at this depth, we show that it is important to add auxiliary losses, both at intermediate network layers and intermediate sequence positions.	Language Modeling	Transformer		Better accuracy				
1805.04623	Sharp Nearby, Fuzzy Far Away: How Neural Language Models Use Context	14	zscore: 3.307777	We know very little about how neural language models (LM) use prior linguistic context. In this paper, we investigate the role of context in an LSTM LM, through ablation studies. Specifically, we analyze the increase in perplexity when prior context words are shuffled, replaced, or dropped. On two standard datasets, Penn Treebank and WikiText-2, we find that the model is capable of using about 200 tokens of context on average, but sharply distinguishes nearby context (recent 50 tokens) from the distant history. The model is highly sensitive to the order of words within the most recent sentence, but ignores word order in the long-range context (beyond 50 tokens), suggesting the distant past is modeled only as a rough semantic field or topic. We further find that the neural caching model (Grave et al., 2017b) especially helps the LSTM to copy words from within this distant context. Overall, our analysis not only provides a better understanding of how neural LMs use their context, but also sheds light on recent success from cache-based models.	Language Modeling	Evaluation		Insights				
1711.04436	SQLNet: Generating Structured Queries From Natural Language Without   Reinforcement Learning	31	zscore: 3.294092	Synthesizing SQL queries from natural language is a long-standing open problem and has been attracting considerable interest recently. Toward solving the problem, the de facto approach is to employ a sequence-to-sequence-style model. Such an approach will necessarily require the SQL queries to be serialized. Since the same SQL query may have multiple equivalent serializations, training a sequence-to-sequence-style model is sensitive to the choice from one of them. This phenomenon is documented as the "order-matters" problem. Existing state-of-the-art approaches rely on reinforcement learning to reward the decoder when it generates any of the equivalent serializations. However, we observe that the improvement from reinforcement learning is limited.   In this paper, we propose a novel approach, i.e., SQLNet, to fundamentally solve this problem by avoiding the sequence-to-sequence structure when the order does not matter. In particular, we employ a sketch-based approach where the sketch contains a dependency graph so that one prediction can be done by taking into consideration only the previous predictions that it depends on. In addition, we propose a sequence-to-set model as well as the column attention mechanism to synthesize the query based on the sketch. By combining all these novel techniques, we show that SQLNet can outperform the prior art by 9% to 13% on the WikiSQL task.	Generation	Combination		Better accuracy		Text2SQL		
1807.10893	Back-Translation-Style Data Augmentation for End-to-End ASR	6	zscore: 3.270080	In this paper we propose a novel data augmentation method for attention-based end-to-end automatic speech recognition (E2E-ASR), utilizing a large amount of text which is not paired with speech signals. Inspired by the back-translation technique proposed in the field of machine translation, we build a neural text-to-encoder model which predicts a sequence of hidden states extracted by a pre-trained E2E-ASR encoder from a sequence of characters. By using hidden states as a target instead of acoustic features, it is possible to achieve faster attention learning and reduce computational cost, thanks to sub-sampling in E2E-ASR encoder, also the use of the hidden states can avoid to model speaker dependencies unlike acoustic features. After training, the text-to-encoder model generates the hidden states from a large amount of unpaired text, then E2E-ASR decoder is retrained using the generated hidden states as additional training data. Experimental evaluation using LibriSpeech dataset demonstrates that our proposed method achieves improvement of ASR performance and reduces the number of unknown words without the need for paired data.	Speech	Augmentation		Better accuracy		Recognition		
1807.10945	Acoustic and Textual Data Augmentation for Improved ASR of   Code-Switching Speech	6	zscore: 3.270080	In this paper, we describe several techniques for improving the acoustic and language model of an automatic speech recognition (ASR) system operating on code-switching (CS) speech. We focus on the recognition of Frisian-Dutch radio broadcasts where one of the mixed languages, namely Frisian, is an under-resourced language. In previous work, we have proposed several automatic transcription strategies for CS speech to increase the amount of available training speech data. In this work, we explore how the acoustic modeling (AM) can benefit from monolingual speech data belonging to the high-resourced mixed language. For this purpose, we train state-of-the-art AMs, which were ineffective due to lack of training data, on a significantly increased amount of CS speech and monolingual Dutch speech. Moreover, we improve the language model (LM) by creating code-switching text, which is in practice almost non-existent, by (1) generating text using recurrent LMs trained on the transcriptions of the training CS speech data, (2) adding the transcriptions of the automatically transcribed CS speech data and (3) translating Dutch text extracted from the transcriptions of a large Dutch speech corpora. We report significantly improved CS ASR performance due to the increase in the acoustic and textual training data.	Speech	Combination		Better accuracy		Recognition		
1801.07243	Personalizing Dialogue Agents: I have a dog, do you have pets too?	21	zscore: 3.266422	Chit-chat models are known to have several problems: they lack specificity, do not display a consistent personality and are often not very captivating. In this work we present the task of making chit-chat more engaging by conditioning on profile information. We collect data and train models to (i) condition on their given profile information; and (ii) information about the person they are talking to, resulting in improved dialogues, as measured by next utterance prediction. Since (ii) is initially unknown our model is trained to engage its partner with personal topics, and we show the resulting dialogue can be used to predict profile information about the interlocutors.	Generation	Conditioning		More difficult task/data		Dialogue		
1803.02893	An efficient framework for learning sentence representations	25	zscore: 3.248668	In this work we propose a simple and efficient framework for learning sentence representations from unlabelled data. Drawing inspiration from the distributional hypothesis and recent work on learning sentence representations, we reformulate the problem of predicting the context in which a sentence appears as a classification problem. Given a sentence and its context, a classifier distinguishes context sentences from other contrastive sentences based on their vector representations. This allows us to efficiently learn different types of encoding functions, and we show that the model learns high-quality sentence representations. We demonstrate that our sentence representations outperform state-of-the-art unsupervised and supervised representation learning methods on several downstream NLP tasks that involve understanding sentence semantics while achieving an order of magnitude speedup in training time.	Text representations	NA	unsupervised	Better accuracy		Sentence		
1808.06226	SentencePiece: A simple and language independent subword tokenizer and   detokenizer for Neural Text Processing	5	zscore: 3.232399	This paper describes SentencePiece, a language-independent subword tokenizer and detokenizer designed for Neural-based text processing, including Neural Machine Translation. It provides open-source C++ and Python implementations for subword units. While existing subword segmentation tools assume that the input is pre-tokenized into word sequences, SentencePiece can train subword models directly from raw sentences, which allows us to make a purely end-to-end and language independent system. We perform a validation experiment of NMT on English-Japanese machine translation, and find that it is possible to achieve comparable accuracy to direct subword training from raw sentences. We also compare the performance of subword training and segmentation with various configurations. SentencePiece is available under the Apache 2 license at https://github.com/google/sentencepiece.	MT	Toolkit		Other				
1805.04833	Hierarchical Neural Story Generation	12	zscore: 3.158809	We explore story generation: creative systems that can build coherent and fluent passages of text about a topic. We collect a large dataset of 300K human-written stories paired with writing prompts from an online forum. Our dataset enables hierarchical story generation, where the model first generates a premise, and then transforms it into a passage of text. We gain further improvements with a novel form of model fusion that improves the relevance of the story to the prompt, and adding a new gated multi-scale self-attention mechanism to model long-range context. Experiments show large improvements over strong baselines on both automated and human evaluations. Human judges prefer stories generated by our approach to those from a strong non-hierarchical model by a factor of two to one.	Generation	Combination		Better accuracy		Story generation		
1707.07045	End-to-end Neural Coreference Resolution	63	zscore: 3.122299	We introduce the first end-to-end coreference resolution model and show that it significantly outperforms all previous work without using a syntactic parser or hand-engineered mention detector. The key idea is to directly consider all spans in a document as potential mentions and learn distributions over possible antecedents for each. The model computes span embeddings that combine context-dependent boundary representations with a head-finding attention mechanism. It is trained to maximize the marginal likelihood of gold antecedent spans from coreference clusters and is factored to enable aggressive pruning of potential mentions. Experiments demonstrate state-of-the-art performance, with a gain of 1.5 F1 on the OntoNotes benchmark and by 3.1 F1 using a 5-model ensemble, despite the fact that this is the first approach to be successfully trained with no external resources.	Relation extraction	Combination		Better accuracy				
1805.01052	Constituency Parsing with a Self-Attentive Encoder	19	zscore: 3.105843	We demonstrate that replacing an LSTM encoder with a self-attentive architecture can lead to improvements to a state-of-the-art discriminative constituency parser. The use of attention makes explicit the manner in which information is propagated between different locations in the sentence, which we use to both analyze our model and propose potential improvements. For example, we find that separating positional and content information in the encoder can lead to improved parsing accuracy. Additionally, we evaluate different approaches for lexical representation. Our parser achieves new state-of-the-art results for single models trained on the Penn Treebank: 93.55 F1 without the use of any external data, and 95.13 F1 when using pre-trained word representations. Our parser also outperforms the previous best-published accuracy figures on 8 of the 9 languages in the SPMRL dataset.	Parsing	Attention		Better accuracy				
